{
  "schema_version": "1.0",
  "decision_id": "decision-42",
  "recorded_at": "2026-10-10T03:00:00Z",
  "context": {
    "domain_id": "warehouse-returns-a",
    "bundle_digest": "sha256:b92a41ebe64e37d87a74099d74c893196499bca36b1d4b53b1ff88348f3b80d6",
    "semantic_snapshot_digest": "sha256:5b7a1e2d35a6d40d76260ff7fa29f271918faacb273297a22824b776b11e2c1c",
    "deployment_epoch": 7,
    "state_epoch": 4,
    "principal_id": "returns-runtime",
    "workflow_id": "return-42",
    "knowledge_read_view": "transaction:819",
    "knowledge_consistency": "transaction_watermark",
    "knowledge_freshness_policy": {
      "sha256": "sha256:325f9b0419ff60227bb7dfc958548a29ea1bfc236915d16315ccf9f5591351f5",
      "locator": "fixture:knowledge-freshness-policy",
      "media_type": "application/octet-stream",
      "display_version": "fixture-1"
    },
    "context_origin": "trusted_runtime",
    "runtime_instance_id": "runtime-a-7",
    "runtime_attestation": {
      "sha256": "sha256:f81169e8c357e9632fc9be5bb0d20f8a655972be845edcc0971335627e3432c5",
      "locator": "fixture:trusted-runtime-binding-record",
      "media_type": "application/octet-stream",
      "display_version": "fixture-1"
    }
  },
  "authenticated_principal_id": "returns-runtime",
  "observations": [
    {
      "sha256": "sha256:b8020e96ab591cee07518024c246aefd0682e8da5c2b43d1340bb4d3756856b0",
      "locator": "fixture:damaged-battery-return-observation",
      "media_type": "application/octet-stream",
      "display_version": "fixture-1"
    }
  ],
  "actual_evidence_reads": [
    {
      "evidence": {
        "sha256": "sha256:eda4aae8abf8c4668985f4126ada3a419e76257cb476898559d1c2ef0137fa5f",
        "locator": "fixture:current-specialist-review-eligibility",
        "media_type": "application/octet-stream",
        "display_version": "fixture-1"
      },
      "read_at": "2026-10-10T03:00:00Z",
      "read_view_id": "transaction:819",
      "state_revision": "819",
      "maximum_staleness_ms": 0,
      "retrieval_context": {
        "sha256": "sha256:ff9dea79aa25fd7189a9c1bb64a82dd2c4bb7b24d88be1af7f759b6850ac7576",
        "locator": "fixture:evidence-read-receipt",
        "media_type": "application/octet-stream",
        "display_version": "fixture-1"
      }
    }
  ],
  "authorization_input": {
    "sha256": "sha256:40a5eb7c784bbf3ca3140b58794e32f34750806af49c15ca83c4c4a4d227a534",
    "locator": "fixture:resolved-authorization-input",
    "media_type": "application/octet-stream",
    "display_version": "fixture-1"
  },
  "policy_evaluation_receipt": {
    "sha256": "sha256:c83ec34f4c5f143073a6e9ee859867446e2e056d8693c8eb28631f82a3a447ce",
    "locator": "fixture:policy-evaluation-receipt",
    "media_type": "application/octet-stream",
    "display_version": "fixture-1"
  },
  "policy_decision": "permit",
  "action_request": {
    "action_id": "route-to-specialist-handling-review",
    "target_id": "return-42",
    "parameters": {
      "sha256": "sha256:e28d532bfbb1eca2ed42c8d8a6f02c5b709c5534e5afe73f6d460523d90a9044",
      "locator": "fixture:specialist-handling-review-parameters",
      "media_type": "application/octet-stream",
      "display_version": "fixture-1"
    },
    "consequential": true
  },
  "freshness_revalidation": {
    "mode": "transactional_resource_check",
    "performed_at": "2026-10-10T03:00:00Z",
    "read_view_id": "transaction:820",
    "state_revision": "820",
    "critical_inputs": {
      "sha256": "sha256:37be970a9561a623a5acae2aca19b0b354be4cac0e01a6019b5ddbfdca72a6fd",
      "locator": "fixture:revalidated-specialist-review-eligibility",
      "media_type": "application/octet-stream",
      "display_version": "fixture-1"
    },
    "result": "pass",
    "resource_receipt": {
      "sha256": "sha256:c048b690b97babad2b521e36bfaec9d5ea851d8a45ef5d7460159543eec02500",
      "locator": "fixture:resource-freshness-receipt",
      "media_type": "application/octet-stream",
      "display_version": "fixture-1"
    }
  },
  "model_outputs": [
    {
      "sha256": "sha256:f44cd3a2dadb7195dd262043299c2fb6d7f58d2d625319b25eac5bbcfb09092b",
      "locator": "fixture:actual-model-output",
      "media_type": "application/octet-stream",
      "display_version": "fixture-1"
    }
  ],
  "action_outcome": "confirmed_success",
  "outcome_evidence": [
    {
      "sha256": "sha256:1ae194fd139d70f848499181dc342c93960e41df7d14381e73f80db0d4d16736",
      "locator": "fixture:confirmed-specialist-review-referral",
      "media_type": "application/octet-stream",
      "display_version": "fixture-1"
    }
  ],
  "gateway_receipt": {
    "sha256": "sha256:7bbef27435d0cbad99a8e0188ff8dc297ff2a6560f49dd8c3f5ce5e673855e78",
    "locator": "fixture:accepted-specialist-review-receipt",
    "media_type": "application/octet-stream",
    "display_version": "fixture-1"
  },
  "idempotency_key": "return-42-review-1",
  "correlation_id": "change-42"
}
